Unnamed: 0,Unnamed: 1,개념설명,국내 산업규모 (2022),국내 추정여부 (2022),국내 추정근거 (2022),출처 (국내 2022),국내 산업규모 (2023),국내 추정여부 (2023),국내 추정근거 (2023),출처 (국내 2023),국내 산업규모 (2024),국내 추정여부 (2024),국내 추정근거 (2024),출처 (국내 2024),해외 산업규모 (2022),해외 추정여부 (2022),해외 추정근거 (2022),출처 (해외 2022),해외 산업규모 (2023),해외 추정여부 (2023),해외 추정근거 (2023),출처 (해외 2023),해외 산업규모 (2024),해외 추정여부 (2024),해외 추정근거 (2024),출처 (해외 2024)
F040723,샤워기 필터,샤워기에서 헤드 안쪽에 위치하여 물을 거르는 여과 장치,,,,,,,,,,,,,,,,,,,,,,,,
F040724,호스,"자유롭게 휘어지도록 고무, 비닐, 헝겊 따위로 만든 관. 물이나 가스 따위를 보내는 데 씀",,,,,,,,,,,,,,,,,,,,,,,,
F040725,타월, 무명실이 보풀보풀하게 나오도록 짠 천,,,,,,,,,,,,,,,,,,,,,,,,
F040726,욕실발판,	의료 행위에 준하지만 의료법상 비의료기관으로 분류되는 건강관리 서비스 업종,,,,,,,,,,,,,,,,,,,,,,,,
F040727,비누받이,쓰고 난 비누를 올려놓으면 물이 빠질 수 있도록 구멍이 뚫어진 받침,,,,,,,,,,,,,,,,,,,,,,,,
F040728,욕실소품,눈과 시력 관련 질환을 외래 중심으로 진단·치료하는 전문 의료기관,,,,,,,,,,,,,,,,,,,,,,,,
F040801,혀클리너,혀를 닦아서 깨끗하게 하거나 혀에 낀 이물질을 긁어내는 데 쓰는 기구.,,,,,,,,,,,,,,,,,,,,,,,,
F040802,구강청결제,입안을 헹궈 깨끗한 상태로 만드는 약,,,,,,,,,,,,,,,,,,,,,,,,
F040803,면도기,면도할 수 있도록 만든 기구,,,,,,,,,,,,,,,,,,,,,,,,
F040804,"면도크림, 젤","면도를 용이하게 하기 위해 체모, 보통 수염에 바르는 거품 화장품 크림",,,,,,,,,,,,,,,,,,,,,,,,
F040805,생리대,월경을 할 때 분비되는 피를 흡수하여 밖으로 새지 아니하게 만든 것,,,,,,,,,,,,,,,,,,,,,,,,
F040806,성인기저귀,성인용 기저귀,,,,,,,,,,,,,,,,,,,,,,,,
F040807,여성청결제,여들이 외음부를 씻는 데 사용하는 제품,,,,,,,,,,,,,,,,,,,,,,,,
F040808,칫솔,이를 닦는 데 쓰는 솔,,,,,,,,,,,,,,,,,,,,,,,,
F040809,치약,이를 닦는 데 쓰는 약,,,,,,,,,,,,,,,,,,,,,,,,
F040810,면도 날,면도칼의 날,,,,,,,,,,,,,,,,,,,,,,,,
F040811,치실,이 사이에 낀 음식물의 찌꺼기를 빼내거나 닦아 내는 데 쓰기 위하여 왁스를 먹여 만든 의료용 실,,,,,,,,,,,,,,,,,,,,,,,,
F040812,치약꽂이 ,치약을 위생적이고 효율적으로 보관·사용할 수 있는 욕실 소품,,,,,,,,,,,,,,,,,,,,,,,,
F040813,치아미백제,색소 침착이나 법랑질 마모 등의 이유로 노랗게 되거나 어두워진 치아의 색을 하얗고 밝게 만드는 약물,,,,,,,,,,,,,,,,,,,,,,,,
F050101,과외 서비스,지식과 기술 따위를 가르치며 인격을 길러 줌,,,,,,,,,,,,,,,,,,,,,,,,
F050102,입시학원,	수능이나 주요 입시 대비 교육을 제공하는 사설 교육기관,,,,,,,,,,,,,,,,,,,,,,,,
F050103,어린이집,6세 미만의 어린이를 돌보고 기르는 시설,,,,,,,,,,,,,,,,,,,,,,,,
F050104,외국어학원,외국어 실력의 증진을 위하여 회화나 문법 따위를 가르치는 학원,,,,,,,,,,,,,,,,,,,,,,,,
F050105,미술학원,미술에 대한 이론과 표현 방법 따위를 전문적으로 가르치는 학원,,,,,,,,,,,,,,,,,,,,,,,,
F050106,자격증 교육,일정한 신분이나 지위를 가지거나 일정한 일을 하는 데 필요한 조건이나 능력을 가르치는 교육,,,,,,,,,,,,,,,,,,,,,,,,
F050107,취미 교육,전문적으로 하는 것이 아니라 즐기기 위하여 하는 일을 가르치는 학원,,,,,,,,,,,,,,,,,,,,,,,,
F050108,"요가, 필라테스학원","소도구 또는 기구를 활용해 체형교정, 근력 향상을 돕는 소규모 전문 운동 공간",,,,,,,,,,,,,,,,,,,,,,,,
F050109,태권도학원,태권도의 동작과 기술 따위를 전문적으로 가르치는 학원,,,,,,,,,,,,,,,,,,,,,,,,
F050110,운전학원,운전면허 취득을 위해 이론·기능·도로주행 등 체계적 교육과 실습을 제공하는 전문 교육기관,,,,,,,,,,,,,,,,,,,,,,,,
F050111,유치원,학령이 안 된 어린이의 심신 발달을 위한 교육 시설,,,,,,,,,,,,,,,,,,,,,,,,
F050112,음악학원,"박자, 가락, 음성 따위를 갖가지 형식으로 조화하고 결합하는 예술을 가르치는 학원",,,,,,,,,,,,,,,,,,,,,,,,
F050113,재무 교육,	당구 및 포켓볼을 즐길 수 있도록 테이블과 장비를 제공하는 여가 시설,,,,,,,,,,,,,,,,,,,,,,,,
F050114,"음악(악기, 노래)교육",음악을 표현하거나 감상하는 힘을 기르는 예술 교육,,,,,,,,,,,,,,,,,,,,,,,,
F050115,체육(운동)학원,일정한 운동 따위를 통하여 신체를 튼튼하게 단련시키는 목적으로 가르치는 학원,,,,,,,,,,,,,,,,,,,,,,,,
F050201,상조서비스,관혼상제에 대비항 가정의례 서비스 제공을 목적으로 하는 사업을 영위하는 회사,,,,,,,,,,,,,,,,,,,,,,,,
F050202,장례식장,장례 의식을 치르는 장소.,,,,,,,,,,,,,,,,,,,,,,,,
F050203,장의용품,장례를 치르는 데 필요한 여러 종류의 물품.,,,,,,,,,,,,,,,,,,,,,,,,
F050301,배달대행 서비스,음식점의 배달 서비스를 대신하고 가맹점으로부터 월간 회비 및 배달 요금을 과금하여 대행 기사에게 지급하는 '배달 중개 서비스' 사업,,,,,,,,,,,,,,,,,,,,,,,,
F050302,방문 판매업,"기업, 정부, 단체 등에서 신제품 개발, 정책 수립, 마케팅 전략, 사회 트렌드 파악 등을 위해 소비자·시민의 의견, 행동, 시장 동향을 체계적으로 조사·분석하는 전문 서비스",,,,,,,,,,,,,,,,,,,,,,,,
F050303,다이닝 펍,"다양한 음식과 주류를 캐주얼한 분위기에서 즐길 수 있는 외식 공간으로, 트렌디한 인테리어, 다양한 메뉴, 라이브 공연, 모임·파티 등 복합 문화 공간",,,,,,,,,,,,,,,,,,,,,,,,
F050304,무인매장,"무인 결제·출입 시스템, AI·IoT 기반 운영, 24시간 운영 등으로 인건비 절감과 편의성을 높인 매장 형태",,,,,,,,,,,,,,,,,,,,,,,,
F050305,푸드트럭,"기업의 경영 전략, 조직 혁신, 마케팅, 재무, 인사, IT 등 다양한 분야에서 전문 컨설턴트가 분석·진단·솔루션을 제공해 경영 효율성과 경쟁력 강화를 지원하는 서비스",,,,,,,,,,,,,,,,,,,,,,,,
F050401,게스트하우스,외부 손님이나 방문객들이 머물 수 있도록 마련된 공간. 또는 그러한 집,,,,,,,,,,,,,,,,,,,,,,,,
F050402,리조트,재미있게 놀거나 편안히 쉴 수 있는 시설을 갖춘 곳,,,,,,,,,,,,,,,,,,,,,,,,
F050403,여관,일정한 돈을 받고 손님을 묵게 하는 집,,,,,,,,,,,,,,,,,,,,,,,,
F050404,모텔,자동차 여행자가 숙박하기에 편하도록 만들어 놓은 여관,,,,,,,,,,,,,,,,,,,,,,,,
F050405,펜션,민박의 가정적 분위기와 호텔의 편의성을 갖춘 소규모의 고급 숙박 시설,,,,,,,,,,,,,,,,,,,,,,,,
F050406,호텔,비교적 규모가 큰 서양식 고급 여관,,,,,,,,,,,,,,,,,,,,,,,,
F050407,"기숙사, 고시원","학생, 직장인, 시험 준비생 등에게 저렴한 비용으로 숙박과 기본 생활 공간을 제공하는 공동주거시설",,,,,,,,,,,,,,,,,,,,,,,,
F050408,"차박, 캠핑카","자동차 또는 캠핑카를 이용해 야외에서 숙박·여행을 즐기는 방식, 자유로운 이동, 자연 체험, 취사·취침·샤워 등 생활이 가능한 이동형 숙박시설 제공",,,,,,,,,,,,,,,,,,,,,,,,
F050501,PC방,손님이 인터넷 따위를 이용할 수 있도록 개인용 컴퓨터를 갖추어 놓고 영업을 하는 곳,,,,,,,,,,,,,,,,,,,,,,,,
F050502,주유소,자동차 따위에 기름을 넣는 곳,,,,,,,,,,,,,,,,,,,,,,,,
F050503,네일샵 (shop),손톱을 아름답게 가꾸어 주고 장식하는 일을 전문적으로 하는 가게,,,,,,,,,,,,,,,,,,,,,,,,
F050504,노래방,방음이 된 방에서 가사가 화면에 나타나는 음악 반주기에 맞추어 노래를 부르도록 장치를 해 놓은 곳,,,,,,,,,,,,,,,,,,,,,,,,
F050505,셀프 빨래방,자동 세탁기에 빨랫감을 넣고 동전을 넣어 작동할 수 있도록 설비를 갖춘 세탁업소,,,,,,,,,,,,,,,,,,,,,,,,
F050506,세탁소,돈을 받고 남의 빨래나 다림질 따위를 해 주는 곳,,,,,,,,,,,,,,,,,,,,,,,,
F050507,"스터디카페, 독서실","차를 마시며 토론이나 세미나, 공부 따위를 할 수 있게 만든 카페",,,,,,,,,,,,,,,,,,,,,,,,
F050508,"전시, 행사대행 서비스","기업, 기관, 단체의 전시회, 박람회, 컨퍼런스, 프로모션, 문화행사 등을 기획, 운영, 홍보, 현장 관리까지 일괄 대행하는 서비스",,,,,,,,,,,,,,,,,,,,,,,,
F050509,당구장,자동차나 오디오 따위의 일부분을 개조하는 일,,,,,,,,,,,,,,,,,,,,,,,,
F050510,탁구장,자동차를 수리하거나 정비하는 업소,,,,,,,,,,,,,,,,,,,,,,,,
F050511,목욕/사우나,"공공기관, 학교, 병원, 지하철, 상가, 오피스 등 다중이용시설의 청결 유지, 위생 관리, 환경 미관 개선을 위해 전문 인력과 장비로 청소, 소독, 폐기물 처리, 바닥·유리·화장실 관리 등을 대행하는 서비스",,,,,,,,,,,,,,,,,,,,,,,,
F050512,피부관리실,"신체 외부의 선천적·후천적 기형, 변형, 결손의 교정과 외모 개선을 위해 재건 성형, 미용 성형, 시술, 상담을 제공하는 전문 의료기관",,,,,,,,,,,,,,,,,,,,,,,,
F050601,골프연습장,골프 연습을 할 수 있도록 일정한 설비를 갖추어 놓은 곳,,,,,,,,,,,,,,,,,,,,,,,,
F050602,라켓볼장,"실내에서 라켓과 공을 사용해 벽에 공을 쳐서 점수를 겨루는 라켓볼 경기를 위한 전문 체육시설로, 단식·복식 경기, 장비 대여, 레슨, 동호회 활동 등 포함",,,,,,,,,,,,,,,,,,,,,,,,
F050603,볼링장,볼링을 할 수 있게 설비를 갖춘 곳,,,,,,,,,,,,,,,,,,,,,,,,
F050604,댄스학원,"발레, 현대무용, 힙합, 스트릿댄스, 라틴 등 다양한 장르의 춤을 체계적으로 배우고 연습할 수 있는 교육 공간",,,,,,,,,,,,,,,,,,,,,,,,
F050605,헬스장,건강이나 미용을 증진하기 위한 운동ㆍ휴식 시설을 갖춘 체육관,,,,,,,,,,,,,,,,,,,,,,,,
F050701,동물병원/수의사,동물의 병을 예방하거나 진찰하고 치료하는 곳,,,,,,,,,,,,,,,,,,,,,,,,
F050702,변호사/법무사/세무회계사,"타인의 위촉에 의하여 변호, 법무, 세무회계의 업무를 하는 전문직",,,,,,,,,,,,,,,,,,,,,,,,
F050703,치과/의원/병원,"30병상 미만의 경증 질환을 다루는 치과, 의원, 병원",,,,,,,,,,,,,,,,,,,,,,,,
F050704,부동산 중개소,다른 사람을 위하여 부동산 거래를 대리하거나 중개하고 수수료를 받는 영업소,,,,,,,,,,,,,,,,,,,,,,,,
F050705,유사 의료업,"사방이 벽으로 둘러싸인 코트에서 라켓과 고무공을 사용해 벽에 공을 쳐서 경기를 하는 실내 스포츠 시설로, 개인 또는 복식 경기가 가능하고, 체력·순발력·전략이 중요한 운동 공간",,,,,,,,,,,,,,,,,,,,,,,,
F050706,방사선 진단 의료원,"X선, CT, MRI, 초음파, PET 등 첨단 영상장비를 이용해 질병의 진단, 치료 계획, 경과 관찰, 암 치료 등을 수행하는 전문 의료기관",,,,,,,,,,,,,,,,,,,,,,,,
F050707,일반 병원,30~100병상 규모의 기본적인 검사와 치료가 가능한 병원,,,,,,,,,,,,,,,,,,,,,,,,
F050708,요양원/요양병원,노인이나 장애인 등 거동이 불편한 사람들이 생활할 수 있는 시설이나 병원,,,,,,,,,,,,,,,,,,,,,,,,
F050709,한의원/한방병원,"한의학의 원리와 방법으로 한의사가 질병을 진단, 치료하는 시설이나 병원",,,,,,,,,,,,,,,,,,,,,,,,
F050710,종합병원,"100~500병상 규모의 수술, 입원치료, 응급치료가 가능한 병원",,,,,,,,,,,,,,,,,,,,,,,,
F050801,자유여행,여행사에 의뢰하지 않고 본인의 계획에 따라 자유롭게 다니는 여행,,,,,,,,,,,,,,,,,,,,,,,,
F050802,국내여행,일이나 유람을 목적으로 나라 안의 다른 고장에 가는 일,,,,,,,,,,,,,,,,,,,,,,,,
F050803,해외여행,일이나 여행을 목적으로 외국에 가는 일,,,,,,,,,,,,,,,,,,,,,,,,
F050804,놀이공원,돌아다니며 구경하거나 놀 수 있도록 여러 가지 시설이나 놀이 기구를 갖추어 놓은 곳,,,,,,,,,,,,,,,,,,,,,,,,
F050805,여행 예약 서비스업,"운동, 스포츠, 야외활동, 취미 및 여가를 즐기기 위해 사용하는 장비, 의류, 신발, 액세서리, 피트니스 기구 등 다양한 제품군",,,,,,,,,,,,,,,,,,,,,,,,
F050806,유람선/보트,구경하는 손님을 태우고 다니는 배.,,,,,,,,,,,,,,,,,,,,,,,,
F050807,항공,동력으로 프로펠러를 돌리거나 연소 가스를 내뿜는 힘에 의하여 생기는 양력을 이용하여 공중으로 떠서 날아다니는 항공기,,,,,,,,,,,,,,,,,,,,,,,,
F050901,미술관,미술품을 전시하는 시설.,,,,,,,,,,,,,,,,,,,,,,,,
F050902,박물관,"고고학적 자료, 역사적 유물, 예술품, 그 밖의 학술 자료를 수집ㆍ보존ㆍ진열하고 일반에게 전시하여 학술 연구와 사회 교육에 기여할 목적으로 만든 시설.",,,,,,,,,,,,,,,,,,,,,,,,
F050903,전시회,특정한 물건을 벌여 차려 놓고 일반에게 참고가 되게 하는 모임.,,,,,,,,,,,,,,,,,,,,,,,,
F050904,도서관,"온갖 종류의 도서, 문서, 기록, 출판물 따위의 자료를 모아 두고 일반이 볼 수 있도록 한 시설.",,,,,,,,,,,,,,,,,,,,,,,,
F050905,공연장,"음악, 연극, 무용, 오페라 등 다양한 공연 예술을 무대에서 관람할 수 있는 전문 시설",,,,,,,,,,,,,,,,,,,,,,,,
F050906,영화관,다양한 장르의 영화를 대형 스크린과 음향 시스템에서 관람할 수 있는 상영 공간,,,,,,,,,,,,,,,,,,,,,,,,
F050907,콘서트,음악을 연주하여 청중이 음악을 감상하게 하는 모임.,,,,,,,,,,,,,,,,,,,,,,,,
F050908,사무지원 서비스업,"기업·기관의 효율적인 운영을 위해 문서작성, 회계, 인사, 비서, 시설관리, IT지원 등 다양한 사무 업무를 대행·지원하는 서비스",,,,,,,,,,,,,,,,,,,,,,,,
F050909,지역축제,한 지역을 중심으로 열리는 축제.,,,,,,,,,,,,,,,,,,,,,,,,
F050910,강연 서비스,"	특정 분야 전문가를 섭외해 오프라인,온라인 강연을 제공하는 B2B,B2C 서비스",,,,,,,,,,,,,,,,,,,,,,,,
F050911,"공원(근린, 생태, 자연)",인공적인 부분을 최소화하고 자연 그대로의 모습이 유지될 수 있도록 주변 환경을 변형하지 않고 최대한 활용하여 만든 공원.,,,,,,,,,,,,,,,,,,,,,,,,
F050912,호수,"	수상 액티비티와 산책, 자연경관을 중심으로 조성된 여가 및 관광 공간",,,,,,,,,,,,,,,,,,,,,,,,
F060101,골프용품,골프를 치는 데 필요한 용품.,,,,,,,,,,,,,,,,,,,,,,,,
F060102,골프웨어,	테니스 경기를 위한 실내외 전용 시설 운영 사업,,,,,,,,,,,,,,,,,,,,,,,,
F060103,스크린골프,	골프 입문자부터 실전 훈련까지 가능한 실내외 연습 시설,,,,,,,,,,,,,,,,,,,,,,,,
F060104,낚시용품,낚시를 할 때 사용하는 물품.,,,,,,,,,,,,,,,,,,,,,,,,
F060105,등산용품,등산을 하는 데 쓰이는 여러 가지 물품.,,,,,,,,,,,,,,,,,,,,,,,,
F060106,등산의류,	탁구를 중심으로 한 소규모 스포츠 공간 사업,,,,,,,,,,,,,,,,,,,,,,,,
F060107,접이식의자,평소에는 접어 두었다가 앉을 때 펼 수 있도록 만든 의자.,,,,,,,,,,,,,,,,,,,,,,,,
F060108,침낭,"겹으로 된 천 사이에 솜, 깃털 따위를 넣고 자루 모양으로 만든 침구. 주로 야영할 때에 쓴다.",,,,,,,,,,,,,,,,,,,,,,,,
F060109,"캠핑, 글램핑","자연 속에서 텐트, 카라반, 캠핑카, 글램핑 돔 등 다양한 숙박 형태로 야외 체험, 휴식, 레저를 즐기는 활동",,,,,,,,,,,,,,,,,,,,,,,,
F060110,캠핑용품,캠핑을 하는 데 사용하는 물품.,,,,,,,,,,,,,,,,,,,,,,,,
F060111,텐트,"산ㆍ들ㆍ물가 따위에서 야영을 할 때, 눈ㆍ비ㆍ바람 따위를 막거나 볕을 가리기 위하여 기둥을 세우거나 말뚝을 박고 포장 천으로 막처럼 지어 놓은 것. 또는 그런 데에 쓰는 포장 천",,,,,,,,,,,,,,,,,,,,,,,,
F060112,AI 낚시 플랫폼,"다양한 브랜드와 종류의 모터사이클, 스쿠터, 전기바이크 등 이륜차 및 관련 부품, 액세서리, 정비서비스를 소비자에게 판매하는 소매업",,,,,,,,,,,,,,,,,,,,,,,,
F060113,태클박스,"남성용 정장, 캐주얼, 스포츠웨어, 액세서리 등 다양한 스타일의 의류와 패션 소품을 판매하는 전문 소매점",,,,,,,,,,,,,,,,,,,,,,,,
F060114,접이식테이블,접었다 폈다 할 수 있도록 만든 탁자.,,,,,,,,,,,,,,,,,,,,,,,,
F060115,낚시터 운영업,"인공 또는 자연 낚시터를 조성·운영하며, 입장료, 장비 대여, 식음료, 교육, 이벤트 등 다양한 부가 서비스를 제공하는 레저업",,,,,,,,,,,,,,,,,,,,,,,,
F060116,해먹,기둥 사이나 나무 그늘 같은 곳에 달아매어 침상으로 쓰는 그물.,,,,,,,,,,,,,,,,,,,,,,,,
F060117,타이머 냄비,"요리 시간 맞춤, 자동 알림, 과열 방지 등 타이머 기능이 내장된 냄비로, 바쁜 현대인의 편리한 요리와 안전을 지원하는 주방용품",,,,,,,,,,,,,,,,,,,,,,,,
F060118,AI 셀프카트,"건설, 기계, 전기, 환경, IT 등 다양한 산업 분야에서 설계, 감리, 컨설팅, 기술 자문, 시공 관리, 프로젝트 관리 등 전문 엔지니어링 서비스를 제공하는 사업 서비스업",,,,,,,,,,,,,,,,,,,,,,,,
F060119,AI 스윙분석앱,"실, 원단, 직물, 의류, 커튼, 침구, 수예용품 등 섬유 및 실로 만든 다양한 제품을 소비자에게 판매하는 소매업",,,,,,,,,,,,,,,,,,,,,,,,
F060201,패들보드,"두통, 어지럼증, 치매, 파킨슨병, 뇌졸중 등 신경계 질환과 우울증, 불안, 스트레스, 불면, ADHD 등 정신건강 문제를 외래 진료 중심으로 상담, 진단, 약물치료, 심리치료를 제공하는 의원",,,,,,,,,,,,,,,,,,,,,,,,
F060202,"수상, 해양 레저업","바다, 강, 호수 등 수상에서 모터보트, 요트, 카약, 서핑, 스쿠버다이빙, 수상스키 등 다양한 수상·해양 레저 활동 및 장비·시설·교육·이벤트를 제공하는 서비스업",,,,,,,,,,,,,,,,,,,,,,,,
F060203,서핑,파도를 이용하여 타원형의 널빤지를 타고 파도 속을 교묘히 빠져나가며 즐기는 놀이,,,,,,,,,,,,,,,,,,,,,,,,
F060204,수영장,"수영, 물놀이, 수중운동, 수중치료, 휴식 등 다양한 목적을 위해 인공적으로 물을 채운 실내·실외 시설",,,,,,,,,,,,,,,,,,,,,,,,
F060205,수영,스포츠나 놀이로서 물속을 헤엄치는 일,,,,,,,,,,,,,,,,,,,,,,,,
F060206,스노클링,"물안경과 오리발, 스노클 정도의 간단한 장비들을 이용하여 잠수를 즐기는 스포츠",,,,,,,,,,,,,,,,,,,,,,,,
F060207,아쿠아슈즈,물속에서도 편하게 신고 다닐 수 있는 샌들,,,,,,,,,,,,,,,,,,,,,,,,
F060208,카누,노로 젓는 작은 배,,,,,,,,,,,,,,,,,,,,,,,,
F060209,방수 클러치,"	물놀이, 캠핑, 야외 활동 중에도 내용물을 안전하게 보관할 수 있는 방수 가방",,,,,,,,,,,,,,,,,,,,,,,,
F060210,수상스키,모터보트에 맨 로프를 쥐고 보트에 이끌려 수면을 활주하는 스키,,,,,,,,,,,,,,,,,,,,,,,,
F060211,다이빙,"수영에서, 높은 곳에서 뛰어 머리를 먼저 물속에 잠기게 하여 들어가는 일을 겨루는 경기",,,,,,,,,,,,,,,,,,,,,,,,
F060301,러닝머신,	실내에서 걷기 또는 달리기를 할 수 있는 전동식 운동기기,,,,,,,,,,,,,,,,,,,,,,,,
F060302,스포츠잡화 ,운동을 할 때 사용하는 여러 가지 물품,,,,,,,,,,,,,,,,,,,,,,,,
F060303,남성 스포츠의류,남성이 운동할 때 입는 옷 등속(等屬)을 통틀어 이르는 말,,,,,,,,,,,,,,,,,,,,,,,,
F060304,라켓스포츠 용품,라켓을 이용하여 승패를 겨루는 경기,,,,,,,,,,,,,,,,,,,,,,,,
F060305,스포츠 보호대,신체 등을 보호하기 위해 대거나 두르는 도구,,,,,,,,,,,,,,,,,,,,,,,,
F060306,복싱 용품,두 사람이 양손에 글러브를 끼고 상대편 허리 벨트 위의 상체를 쳐서 승부를 겨루는 경기,,,,,,,,,,,,,,,,,,,,,,,,
F060307,스키/보드 용품,눈 위 경사진 곳을 이동할 때 사용하는 여러 가지 물품,,,,,,,,,,,,,,,,,,,,,,,,
F060308,기타스포츠용품,운동할 때 쓰는 잡다한 물품,,,,,,,,,,,,,,,,,,,,,,,,
F060309,여성 스포츠의류,여성이 운동할 때 입는 옷 등속(等屬)을 통틀어 이르는 말,,,,,,,,,,,,,,,,,,,,,,,,
F060310,일반 스포츠신발,조금 빠른 속도로 달리는 운동을 할 때 신는 신발. 혹은 걷기 운동을 할 때 신는 기능성 운동화,,,,,,,,,,,,,,,,,,,,,,,,
F060311,선수/전문가용 신발,"일정한 규칙에 따라 개인이나 단체끼리 속력, 지구력, 기능 따위를 겨루는 일에 사용하는 신발",,,,,,,,,,,,,,,,,,,,,,,,
F060312,스마트 줄넘기,"	점프 횟수, 칼로리, 운동 시간 등을 측정·기록하는 줄넘기",,,,,,,,,,,,,,,,,,,,,,,,
F060313,헬스 용품,주로 헬스클럽에서 기구를 사용하여 하는 운동을 할 때 사용하는 여러 가지 물품,,,,,,,,,,,,,,,,,,,,,,,,
F060314,폼롤러워머,	근육을 이완시키는 폼롤러에 열을 더해 효과를 극대화한 운동 보조기기,,,,,,,,,,,,,,,,,,,,,,,,
F060315,홈트레이닝 용품,집 안에서 간단한 웨이트 트레이닝 기구들을 사용하여 하는 근력 운동을 할 때 사용하는 여러 가지 물품,,,,,,,,,,,,,,,,,,,,,,,,
F060316,체중계,몸무게를 재는 데에 쓰는 저울,,,,,,,,,,,,,,,,,,,,,,,,
F060317,수납형 스텝박스,	운동용 스텝박스 기능과 수납 기능을 결합한 다기능 제품,,,,,,,,,,,,,,,,,,,,,,,,
F060318,요가링,	몸의 긴장을 풀고 유연성을 높이는 데 사용하는 고리 형태의 요가 도구,,,,,,,,,,,,,,,,,,,,,,,,
F060319,스쿼트보조기,스쿼트 동작 시 자세를 유지하고 무릎에 무리를 줄여주는 운동 보조기기,,,,,,,,,,,,,,,,,,,,,,,,
F060320,요가 용품,고대 인도에서부터 전하여 오는 심신 단련법의 하나를 할 때 사용하는 물품,,,,,,,,,,,,,,,,,,,,,,,,
F060321,"개인, 가정용품 대여업","다양한 생활용품, 운동기구, 소형가전 등을 단기간 필요에 따라 대여, 비용 절감, 공간 활용, 환경 보호, 관리 서비스 제공",,,,,,,,,,,,,,,,,,,,,,,,
F060401,자전거,사람이 타고 앉아 두 다리의 힘으로 바퀴를 돌려서 가게 된 탈것,,,,,,,,,,,,,,,,,,,,,,,,
F060402,액션캠,	원심력 회전을 통해 손목과 팔 근육을 강화하는 회전형 운동기구,,,,,,,,,,,,,,,,,,,,,,,,
F060403,자전거 의류,"자전거를 탈 때 페달링이 훨씬 가볍고 편하며, 엉덩이도 덜 아프게 해주는 옷",,,,,,,,,,,,,,,,,,,,,,,,
F060404,킥보드,두 손으로 핸들을 잡고 한쪽 발을 발판 위에 올린 뒤 다른 한쪽 발로는 땅을 차면서 타게 되어 있는 기구,,,,,,,,,,,,,,,,,,,,,,,,
F060405,킥보드 용품,킥보드를 사용할 때 필요한 여러 가지 물품.,,,,,,,,,,,,,,,,,,,,,,,,
F060406,스케이트,구두 바닥에 쇠 날을 붙이고 얼음판 위를 지치는 운동 기구,,,,,,,,,,,,,,,,,,,,,,,,
F060407,스케이트 용품,구두 바닥에 쇠 날을 붙이고 얼음판 위를 지치는 운동 기구를 사용할 때 필요한 여러 가지 물품,,,,,,,,,,,,,,,,,,,,,,,,
F070101,간편식,간단하고 편리하게 조리하여 먹을 수 있는 음식. 또는 그렇게 만든 음식,,,,,,,,,,,,,,,,,,,,,,,,
F070102,"마라탕, 훠궈","고객이 원하는 재료를 골라 끓여 먹는 중국식 향신료 탕 요리(테이크아웃, 배달형도 포함)",,,,,,,,,,,,,,,,,,,,,,,,
F070103,김치가공식품,"	김치를 활용한 다양한 형태의 가공식품 (스낵형, 소스형, 캡슐형 등)",,,,,,,,,,,,,,,,,,,,,,,,
F070104,두부가공식품,"	두부를 기반으로 한 다양한 형태의 가공식품 (스낵형, 디저트형, 단백질식 등)",,,,,,,,,,,,,,,,,,,,,,,,
F070105,"전, 부침개","곡식 가루를 찌거나, 그 찐 것을 치거나 빚어서 만든 음식을 통틀어 이르는 말",,,,,,,,,,,,,,,,,,,,,,,,
F070106,만두요리,	다양한 형태와 속 재료로 구성된 만두를 활용한 전문 요리 및 외식 서비스,,,,,,,,,,,,,,,,,,,,,,,,
F070107,"냉면, 국수 전문점","	국수만을 중심으로 한 식사 제공점, 지역별 전통국수 또는 창작 국수 포함",,,,,,,,,,,,,,,,,,,,,,,,
F070108,밀키트,"요리에 필요한 손질된 식재료와 딱 맞는 양의 양념, 조리법을 세트로 구성해 제공하는 제품",,,,,,,,,,,,,,,,,,,,,,,,
F070109,반찬 전문점,	다양한 종류의 반찬을 소분 또는 세트로 판매하는 소매 형태의 외식 가공업,,,,,,,,,,,,,,,,,,,,,,,,
F070110,분식 전문점,"	김밥, 만두, 떡볶이 등 대중적인 분식류를 조합하여 제공하는 외식업",,,,,,,,,,,,,,,,,,,,,,,,
F070111,즉석 식품,간단히 조리할 수 있고 저장이나 휴대에도 편리한 가공식품,,,,,,,,,,,,,,,,,,,,,,,,
F070112,반조리 식품,조리 시간의 단축과 조리 방법의 용이함을 위하여 미리 손질하여 놓은 식품,,,,,,,,,,,,,,,,,,,,,,,,
F070113,참치 전문점,"	참치를 다양한 방식(회, 구이, 조림 등)으로 제공하는 외식 전문점",,,,,,,,,,,,,,,,,,,,,,,,
F070114,냉동식품,오래 보관하기 위하여 얼린 식품,,,,,,,,,,,,,,,,,,,,,,,,
F070115,"족발, 보쌈 전문점",주식(主食) 대신으로 먹는 음식,,,,,,,,,,,,,,,,,,,,,,,,
