Unnamed: 0,Unnamed: 1,개념설명,국내 산업규모 (2022),국내 추정여부 (2022),국내 추정근거 (2022),출처 (국내 2022),국내 산업규모 (2023),국내 추정여부 (2023),국내 추정근거 (2023),출처 (국내 2023),국내 산업규모 (2024),국내 추정여부 (2024),국내 추정근거 (2024),출처 (국내 2024),해외 산업규모 (2022),해외 추정여부 (2022),해외 추정근거 (2022),출처 (해외 2022),해외 산업규모 (2023),해외 추정여부 (2023),해외 추정근거 (2023),출처 (해외 2023),해외 산업규모 (2024),해외 추정여부 (2024),해외 추정근거 (2024),출처 (해외 2024)
code,code_name,item_contents,,,,,,,,,,,,,,,,,,,,,,,,
F010101,스마트 허브,다양한 스마트 가전·센서·기기를 하나의 시스템으로 연결·제어할 수 있게 해주는 중앙 관리 장치,,,,,,,,,,,,,,,,,,,,,,,,
F010102,공유기,여러 대의 컴퓨터가 유선이나 무선으로 하나의 인터넷 라인을 공유해 동시에 인터넷에 접속할 수 있도록 하는 네트워크 기기,420000000,1,2024년 한국 무선 라우터 시장 규모 약 4692억 원으로부터 과거 성장률 10% 내외를 추정하여 산출,https://v.daum.net/v/Wun1pAaV8I,450000000,1,2024년 시장 규모 4692억 원 및 연간 약 10.6% 성장 전망 기반으로 추정,https://v.daum.net/v/Wun1pAaV8I,469200000,0,"글로벌 시장 조사 기업 6Wresearch에서 직접 발표한 2024년 한국 무선 라우터 시장 규모 데이터 활용, 약 4692억 원 규모 확인",https://v.daum.net/v/Wun1pAaV8I,3390000000,1,글로벌 IoT 및 Wi-Fi 라우터 시장 규모와 연평균 성장률 9~12%를 고려하여 추정,https://www.globalict.kr/upload_file/kms/202403/54723923920628804.pdf,3700000000,1,글로벌 IoT 시장 및 Wi-Fi 라우터 시장 성장 예측 수치 기반 추정치,https://www.globalict.kr/upload_file/kms/202403/54723923920628804.pdf,4100000000,1,글로벌 Wi-Fi 라우터 시장 규모 2024년 약 41억 달러로 시장 조사 기관 자료를 토대로 산출,https://www.globalict.kr/upload_file/kms/202403/54723923920628804.pdf
F010103,노트북,다양한 컴퓨팅 작업을 이동 중에도 수행할 수 있도록 설계된 휴대용 일체형 컴퓨터 솔루션,"1,350,000",0,한국IDC PC 시장 연구 분석,https://www.ilovepc.co.kr/news/articleView.html?idxno=51304,"945,000",0,한국IDC PC 시장 연구 분석,https://news.zum.com/articles/94113060,"936,000",1,2024년 상반기 PC 출하량을 기준으로 추정,https://my.idc.com/getdoc.jsp?containerId=prAP53225025,"18,300,000",1,글로벌 PC 시장 전체 성장률과 출하량을 고려한 추정,https://news.zum.com/articles/94113060,"14,310,000",1,트렌드포스 조사에 따른 글로벌 노트북 출하량 감소 추정,https://news.zum.com/articles/94113060,"14,090,000",1,2023년 출하량을 바탕으로의 추정,https://www.qyr.co.kr/reports/47775/laptop
F010104,마우스,책상 위에 올려 두고 손으로 잡아끌거나 눌러서 컴퓨터를 작동시키는 입력장치,7800000,1,"2017년부터 2023년까지 국내 PC 주변기기 마우스 시장 규모는 연평균 3.6% 성장률을 적용한 추정치임. 2017년 84억원에서 2023년 81억원 규모로 예측됨. 앱코의 보고서 및 국내 PC 주변기기 시장 점유율, 성장률 참고.",https://ssl.pstatic.net/imgstock/upload/research/company/1648689388040.pdf,8100000,1,2017~2023년 연평균 3.6% 성장률을 적용하여 2023년 국내 마우스 시장 규모를 추정. 앱코의 2022년 보고서 기반.,https://ssl.pstatic.net/imgstock/upload/research/company/1648689388040.pdf,8500000,1,"2023년 추정 규모와 최근 e스포츠 등 게이밍 기어 수요 증가, 반도체 수급 개선 전망을 반영해 3.6% 성장률 적용 추정.",https://ssl.pstatic.net/imgstock/upload/research/company/1648689388040.pdf,29300000,1,2023년 글로벌 무선마우스 시장 규모 2억 9300만 달러에서 CAGR 7.9%를 적용해 추정.,https://www.theinsightpartners.com/ko/reports/wireless-mouse-market,31700000,1,2023년 무선마우스 시장 2억 9300만 달러에서 7.9% CAGR 적용해 산출.,https://www.theinsightpartners.com/ko/reports/wireless-mouse-market,36500000,1,2023년부터 2024년까지 7.9% 연평균 성장률을 반영해 추정.,https://www.theinsightpartners.com/ko/reports/wireless-mouse-market
F010105,일반 모니터,"데스크탑 PC나 노트북과 연결하여 영상, 이미지, 텍스트 등 시각 정보를 출력해주는 시각 표시용 디스플레이 장치",7000000000,1,"국내 전체 모니터 시장 출하량과 게이밍 모니터 매출 증가세, OLED 모니터 시장 성장률, 글로벌 4K 모니터 시장 규모 및 성장률을 토대로 추정. 정확한 국내 일반 모니터 시장 규모 데이터 없으나, 전체 모니터 시장 약 7천억원 추정.",https://www.chosun.com/economy/tech_it/2025/04/15/4DMZPBGRIFE2XPVUMMKJCXPNRM/ https://www.prnewswire.com/kr/news-releases/uC634uB514uC544u003Au002Du006Fu006Cu0065u0064u002DuBAA8uB2C8uD130u002DuB514uC2A4uD50CuB808uC774u002DuCD9CuD558uB7C9u002Cu002DuC8FCuC694u002D-302139682.html https://www.financialpost.co.kr/news/articleView.html?idxno=224499,7200000000,1,2022년 대비 국내 모니터 시장 연평균 성장률과 OLED·게이밍 시장 성장 추세 반영 추정.,https://www.chosun.com/economy/tech_it/2025/04/15/4DMZPBGRIFE2XPVUMMKJCXPNRM/ https://www.prnewswire.com/kr/news-releases/uC634uB514uC544u003Au002Du006Fu006Cu0065u0064u002DuBAA8uB2C8uD130u002DuB514uC2A4uD50CuB808uC774u002DuCD9CuD558uB7C9u002Cu002DuC8FCuC694u002D-302139682.html https://www.financialpost.co.kr/news/articleView.html?idxno=224499,7500000000,1,2023년 추세와 글로벌 4K 모니터 및 OLED 시장 성장률을 반영하여 국내 일반 모니터 시장 규모 소폭 증가로 추정.,https://www.chosun.com/economy/tech_it/2025/04/15/4DMZPBGRIFE2XPVUMMKJCXPNRM/ https://www.prnewswire.com/kr/news-releases/uC634uB514uC544u003Au002Du006Fu006Cu0065u0064u002DuBAA8uB2C8uD130u002DuB514uC2A4uD50CuB808uC774u002DuCD9CuD558uB7C9u002Cu002DuC8FCuC694u002D-302139682.html https://www.financialpost.co.kr/news/articleView.html?idxno=224499,33795000000,0,글로벌 4K 모니터 시장 규모 337.95억 달러가 명시된 공식 데이터로 측정.,https://www.businessresearchinsights.com/ko/market-reports/4k-monitor-market-102932,36600000000,1,2022년 데이터를 기준으로 8% 내외 CAGR을 적용해 추정.,https://www.businessresearchinsights.com/ko/market-reports/4k-monitor-market-102932 https://www.giikorea.co.kr/report/infi1395219-global-computer-monitor-market.html,39700000000,1,2023년 예상 성장률과 4K 모니터 시장 확대 추세를 반영해 추정.,https://www.businessresearchinsights.com/ko/market-reports/4k-monitor-market-102932 https://www.giikorea.co.kr/report/infi1395219-global-computer-monitor-market.html
F010106,소프트웨어,컴퓨터 프로그램 및 그와 관련된 문서들을 통틀어 이르는 말,>= 392000000000,0,IDC와 한국콘텐츠진흥원 등에 따름,https://www.etnews.com/20241121000219,>= 414000000000,0,IDC와 한국콘텐츠진흥원 등에 따름,https://www.etnews.com/20240828000007,>= 444000000000,0,IDC와 한국콘텐츠진흥원 등에 따름,https://www.etnews.com/20241121000219,20920000,0,2022년 글로벌 SW 수출규모는 약 209억2000만 달러로 국내 수출 실적 보고서에 근거함,https://www.etnews.com/20241121000219,18330000,0,"2023년 글로벌 수출은 약 183억3000만 달러 규모이며, 2022년 대비 줄어든 실적임",https://www.etnews.com/20240828000007,19830000,1,2024년 해외 시장 규모는 2023년 대비 글로벌 SW 시장 성장률 약 8% 수준으로 추정하여 계산함,https://industrymarket.co.kr/2024nyeon-gugnae-paekijiswsijang-jeonnyeondaebi/
F010107,노트북 쿨러거치대,노트북의 발열을 줄이고 각도를 조절해 작업 효율을 높이는 도구,3500000,1,"국내 노트북 액세서리 시장 규모가 2023년에 약 420억 원이고, 노트북 쿨러거치대는 관련 제품군 중 하나로 시장 점유율과 성장세를 반영하여 전체 액세서리 시장의 약 0.8% 비율로 추정함.",http://dpg.danawa.com/news/view?boardSeq=63&listSeq=5608258,4200000,1,2023년 국내 노트북 액세서리 시장 성장률과 AI 및 고성능 노트북 증가로 쿨러거치대 수요 확대를 반영하여 약 20% 성장률 적용 추정.,http://dpg.danawa.com/news/view?boardSeq=63&listSeq=5608258,4800000,1,2024년 예상되는 노트북 출하량 증가와 고성능 노트북 보급 확대에 따른 쿨러거치대 수요 상승을 감안해 2023년 대비 약 14% 성장률 적용 추정.,http://dpg.danawa.com/news/view?boardSeq=63&listSeq=5608258,4186600000,False,"글로벌 노트북 쿨링패드 시장 규모는 2022년 기준 약 4,186억 6,548만 달러로 보고되어 있으며, 직접적인 시장 규모 데이터임.",https://reads.alibaba.com/ko/laptop-cooling-pads-what-to-know-before-choosing-them/,4440000000,True,글로벌 시장의 연평균 5-6% 성장률을 반영하여 2023년 시장 규모를 추정함.,https://reads.alibaba.com/ko/laptop-cooling-pads-what-to-know-before-choosing-them/,4710000000,True,2023년 대비 연평균 성장률(CAGR 약 6%)을 반영하여 2024년 시장 규모 추정.,https://reads.alibaba.com/ko/laptop-cooling-pads-what-to-know-before-choosing-them/
F010108,웹캠,웹캠이란 웹과 카메라의 합성어로 인터넷상에서 사용하거나 서비스되는 인터넷 캠코더,,,,,,,,,,,,,6630000000,False,"Mordor Intelligence와 Data Bridge Market Research의 보고서에 근거하여 2022년과 2023년, 2024년 글로벌 웹캠 시장 규모 산출",https://www.mordorintelligence.kr/industry-reports/webcams-market https://www.databridgemarketresearch.com/ko/reports/global-webcams-market,6670000000,False,"Mordor Intelligence와 Data Bridge Market Research의 보고서에 근거하여 2022년과 2023년, 2024년 글로벌 웹캠 시장 규모 산출",https://www.mordorintelligence.kr/industry-reports/webcams-market https://www.databridgemarketresearch.com/ko/reports/global-webcams-market,9110000000,False,Mordor Intelligence의 2024년 웹캠 시장규모 9.11억 달러와 Data Bridge Market Research의 2024년 6.67억 달러 보고서 수치를 참고하여 종합 평가,https://www.mordorintelligence.kr/industry-reports/webcams-market https://www.databridgemarketresearch.com/ko/reports/global-webcams-market
F010109,외장하드,데이터를 저장·백업하기 위한 외부 연결형 스토리지 장치,,,,,,,,,,,,,,,,,,,,,,,,
F010110,이북리더기,전자잉크 디스플레이로 책을 읽을 수 있는 전용 단말기,13000000,True,"국내 웹소설 및 전자책 시장 규모 약 1조 390억원(2022년)과 이북리더기 보급 증가, 웹소설 및 전자책 독서 시 이북리더기 선호도 증가 추세 반영하여 추정",https://device-port.kr/websoseoleul-deo/,15000000,True,2022년 시장 데이터를 바탕으로 국내 웹소설 및 전자책 시장의 연평균 성장률과 이북리더기 보급 확대 추세를 반영하여 추정,https://device-port.kr/websoseoleul-deo/,18000000,True,2023년 추정치에 성장률을 적용하고 이북리더기 사용자 기반 확대와 콘텐츠 소비 증가 추세를 반영하여 추정,https://device-port.kr/websoseoleul-deo/,18020000000,False,"2025년 글로벌 전자책 시장 규모는 약 180억 2천만 달러로 Mordor Intelligence의 데이터 기반, 북미 중심 대규모 시장 데이터",https://www.mordorintelligence.kr/industry-reports/e-book-market,18830000000,True,2022년 규모 대비 약 4.78%의 CAGR을 적용하여 산출(시장 성장률 반영),https://www.mordorintelligence.kr/industry-reports/e-book-market,19740000000,True,2023년 추정치에 시장 성장률 4.78%를 다시 적용하여 산출,https://www.mordorintelligence.kr/industry-reports/e-book-market
F010111,조립PC,소프트웨어를 구동하고 다양한 작업을 처리할 수 있는 전자기기,30000000,True,"한국IDC에 따르면 2022년 국내 PC 출하량은 578만대이며, 조립PC는 시장에서 일정 점유율을 가지므로, 전체 PC 시장 규모(대당 평균 가격 약 50만원 기준)에서 조립PC 점유율(약 20~25%)을 반영하여 추정함. 또한 다나와의 AMD/인텔 프로세서 점유율과 게이밍 PC 성장세를 고려함.",https://www.denews.co.kr/news/articleView.html?idxno=25637,29000000,True,"2023년 국내 PC 출하량은 약 474만대로 감소했으며, 조립PC 비중은 다소 유지되는 것으로 추정. 평균 판매 가격 상승 및 프리미엄 AI PC 출시에 따른 시장 규모 보합을 고려함.",https://my.idc.com/getdoc.jsp?containerId=prAP53225025,29500000,True,"2024년 국내 PC 출하량은 약 474만대로 비슷하며, AI PC 및 게이밍 PC 수요 증가가 조립PC 시장 규모에 긍정적 영향을 미침. 다만 전체 출하량 감소 요인도 반영하여 소폭 증가한 시장 규모로 추정함.",https://zdnet.co.kr/view/?no=20250407140738,4500000000,True,"글로벌 PC 시장 규모는 약 3억대 이상이며, 평균 단가 1000달러 기준으로 약 3000억 달러 규모임. 조립PC 비중은 지역별로 차이나지만 전체의 15% 내외로 추정하여 약 450억 달러로 계산.",https://my.idc.com/getdoc.jsp?containerId=prAP53225025,4550000000,True,글로벌 출하량과 평균 가격 상승 등을 참조하여 조립PC 시장 규모가 소폭 증가한 것으로 추정함.,https://my.idc.com/getdoc.jsp?containerId=prAP53225025,4600000000,True,"AI, 게이밍 수요 확대와 신규 제품 출시를 고려해 조립PC 시장 규모가 지속 확대되는 추세로 보고 소폭 증가 추정함.",https://my.idc.com/getdoc.jsp?containerId=prAP53225025
F010112,키보드,타자기의 자판과 비슷한 모양새를 띤 PC의 입력장치 중 하나,828000,False,"2014~2018년 국내 키보드 시장은 연평균 7.5% 성장, 2023년에는 894억 원(8억 9,400만 천원)에 이를 것으로 전망됨. 2018년 624억 원에서 연평균 7.5%로 추정 시 2022년 약 828억 원으로 계산(2022, 2023년 데이터는 2023 예측치에 비춰 과거 성장률 적용)",https://ssl.pstatic.net/imgstock/upload/research/company/1648689388040.pdf,894000,False,"공식 보고서에 근거한 2023년 국내 키보드 시장 규모 8억 9,400만 천원(894억 원)으로 명시",https://ssl.pstatic.net/imgstock/upload/research/company/1648689388040.pdf,960000,True,"연평균 7.5% 성장률로 가정하여 2023년 대비 2024년 약 9억 6,000만 천원(960억 원) 추정",https://ssl.pstatic.net/imgstock/upload/research/company/1648689388040.pdf,49000000000,True,"글로벌 컴퓨터 키보드 시장 규모는 2025년 기준 549억 불(5,490,000만 천원) 추정, 최신 데이터와 예측치 간 차이로 인해 2024년 글로벌 키보드 시장을 52.7억 불(52.7×1,000,000=52,700,000만 천원)로 보는 시장 조사(Alibaba Reads, 2024.9)와 다소 차이 있으나, 글로벌 시장이 연평균 3~4% 성장을 가정...",https://reads.alibaba.com/ko/the-latest-trends-in-keyboard-technology-and-market-insights/,50800000000,True,"2022~2025년 연평균 3~4% 성장률 가정, 2023년은 50.8억 불(50,800,000만) 추정",https://reads.alibaba.com/ko/the-latest-trends-in-keyboard-technology-and-market-insights/,52700000000,True,"Alibaba Reads(2024.9) 기준, 2024년 글로벌 키보드 시장은 4.9조 원(약 52.7억 불, 52,700,000만)으로 추정, 일부 조사(컴퓨터 키보드 시장, 2025년 549억 불)와 명확한 차이 있으므로, 더 넓은 의미의 '키보드' 시장(특화, 무선, 기계식 포함)로 해석, 2024년 기준 52.7억 불(52,700,000만)로 추정",https://reads.alibaba.com/ko/the-latest-trends-in-keyboard-technology-and-market-insights/
F010113,프린터,컴퓨터에서 처리된 정보를 사람이 눈으로 볼 수 있는 형태로 인쇄하는 출력장치,4540억,False,3D 프린팅 시장 규모,https://www.oss.kr/oss_guide/show/9407dcc0-b1d2-43bc-b660-00a7b778e9b7,약 6200억,True,3D 프린팅 시장 성장에 따른 추정,https://www.oss.kr/oss_guide/show/9407dcc0-b1d2-43bc-b660-00a7b778e9b7,약 6200억,True,3D 프린팅 시장 성장에 따른 추정,https://www.oss.kr/oss_guide/show/9407dcc0-b1d2-43bc-b660-00a7b778e9b7,22010억,False,레이저 프린터 및 기타 프린터 시장 점유율,https://www.databridgemarketresearch.com/ko/reports/global-laser-printer-market,22010억,True,레이저 프린터 및 기타 프린터 시장 점유율에 따른 추정,https://www.databridgemarketresearch.com/ko/reports/global-laser-printer-market,24400억,False,레이저 프린터 시장 규모,https://www.databridgemarketresearch.com/ko/reports/global-laser-printer-market
F010114,마이크,음파 또는 초음파를 받아서 그 진동에 따른 전기신호를 발생하는 장치,,,,,,,,,,,,,1590000000,False,글로벌 무선 마이크 시장 규모 2022년 15억 9천만 달러로 보고됨[Spherical Insights],https://www.sphericalinsights.com/ko/reports/wireless-microphone-market,1720000000,False,글로벌 무선 마이크 시장 2023년 17억 2천만 달러로 성장함[Fortune Business Insights],https://www.fortunebusinessinsights.com/ko/wireless-microphone-market-103099,1997000000,False,글로벌 무선 마이크 시장 2024년 19.97억 달러로 평가됨[Fortune Business Insights],https://www.fortunebusinessinsights.com/ko/wireless-microphone-market-103099
F010115,헤드셋,머리에 장착하는 마이크로폰의 총칭,11000000,True,"2022년 한국 무선 헤드폰 시장은 전년 대비 178% 급증, 시장 점유율과 가격대별 판매 증가 등을 고려해 약 1.1조원으로 추정됨. 30만원 이상 프리미엄 제품 판매 증가와 시장 성장률 반영하여 추정함.",https://magazine.hankyung.com/business/article/202302159652b,13000000,True,"2023년 무선 헤드폰 시장의 견고한 성장과 MZ세대 인기, 프리미엄 제품 판매 증가 추세 유지 반영해 전년 대비 성장률 약 18% 적용하여 약 1.3조원으로 추정.",https://magazine.hankyung.com/business/article/202302159652b,15000000,True,"2024년까지 무선 헤드폰 시장이 계속 확대될 것으로 예상되는 점과 프리미엄 및 패션 아이템화 현상 감안, 2023년 대비 약 15% 성장률 적용하여 약 1.5조원으로 추정.",https://magazine.hankyung.com/business/article/202302159652b,3400000000,True,"2024년 글로벌 이어폰 및 헤드폰 시장이 약 3400억 달러 규모임을 근거로, 2022년은 약 3400억 달러로 유사 수준 추정.",https://www.businessresearchinsights.com/ko/market-reports/earphones-and-headphones-market-101171,3940000000,True,글로벌 시장이 연평균 약 16.2% 성장하는 점을 적용하여 2023년은 약 3940억 달러로 추정.,https://www.businessresearchinsights.com/ko/market-reports/earphones-and-headphones-market-101171,4570800000,True,2024년 예상 연평균 성장률 16.2%를 적용해 약 4571억 달러 규모로 추정.,https://www.businessresearchinsights.com/ko/market-reports/earphones-and-headphones-market-101171
F010116,케이블,여러 개의 전선을 전기가 통하지 않는 껍질로 감싼 줄. 전기 신호를 다른 기기로 보내 주는 역할,,,,,,,,,,,,,10574000000,False,"2022년 동축 케이블 글로벌 시장 규모는 1,057억 4천만 달러로 평가됨. 이는 신뢰 출처의 직접적 데이터임.",https://www.giikorea.co.kr/report/ksi1479954-coaxial-cables-market-forecasts-from.html,11036600000,True,연평균 성장률 4.58% 적용하여 2023년 시장 규모 추정.,https://www.giikorea.co.kr/report/ksi1479954-coaxial-cables-market-forecasts-from.html,11514500000,True,연평균 성장률 4.58% 적용하여 2024년 시장 규모 추정.,https://www.giikorea.co.kr/report/ksi1479954-coaxial-cables-market-forecasts-from.html
F010117,젠더,전자 기기의 접속 규격을 변환하는 데 쓰는 연결 장치,,,,,,,,,,,,,1188400,True,"글로벌 오가닉 및 천연 페미닌 케어 시장이 2023년 12억 8,710만 달러 규모로 예측되며, 2022년은 여기에 CAGR을 역산하여 추정함.",https://www.giikorea.co.kr/report/infi1557590-global-organic-natural-feminine-care-market.html,1287100,False,"시장조사 보고서에서 2023년 기준 12억 8,710만 달러로 명확 제시되어 추정 아님.",https://www.giikorea.co.kr/report/infi1557590-global-organic-natural-feminine-care-market.html,1384500,True,2023년 시장규모에 7.64% CAGR 적용하여 2024년 시장 규모 추정.,https://www.giikorea.co.kr/report/infi1557590-global-organic-natural-feminine-care-market.html
F010118,네트워크,랜(LAN)이나 모뎀 따위의 통신 설비를 갖춘 컴퓨터를 이용하여 서로 연결시켜 주는 조직이나 체계,,,,,,,,,,,,,185000000,True,"2024년 글로벌 네트워크 서비스 시장 규모는 2400억 달러에 달하며, 2022~2024년 데이터는 25.8% CAGR을 적용해 역산 추정함.",https://www.fortunebusinessinsights.com/ko/network-as-a-service-market-106700,215000000,True,글로벌 시장 전체 2023년 가치는 2024년 예상가와 CAGR을 고려하여 추정함.,https://www.fortunebusinessinsights.com/ko/network-as-a-service-market-106700,240000000,False,Fortune Business Insights 보고서에 의해 2024년 글로벌 네트워크 서비스 시장 가치는 2400억 달러로 명확히 제시됨[https://www.fortunebusinessinsights.com/ko/network-as-a-service-market-106700],https://www.fortunebusinessinsights.com/ko/network-as-a-service-market-106700
F010119,와이드 모니터,"가로폭이 넓어 멀티태스킹, 영상 편집, 게임 등에서 더 넓은 작업 공간과 몰입감을 제공하는 디스플레이 장치",1500000000,True,한국 모니터 시장 전체 규모 및 OLED 모니터 출하량 증가에 근거하여 와이드 모니터가 전체 모니터 시장의 약 15% 점유율을 차지한다고 추정함. 2023~2024년은 회복세와 고급 게이밍용 모니터 수요 증가로 시장 확대 추정.,https://kr.prnasia.com/story/111853-9.shtml,1650000000,True,"2022년 추정 근거와 유사하며, 코로나19 팬데믹 이후 멀티스크린 수요 증가와 고해상도 모니터 선호 증가가 이어져 시장 성장 가속화로 추정.",https://kr.prnasia.com/story/111853-9.shtml,1800000000,True,2023년 대비 OLED 모니터 출하량 123% 증가 및 고급 모니터 수요 증가에 기반하여 와이드 모니터 시장이 약 9.1% 성장할 것으로 추정함.,https://kr.prnasia.com/story/111853-9.shtml,900000000,False,"글로벌 4K 게임 모니터 시장 규모가 2022년에 9억 달러 수준이며, 이는 와이드 모니터 포함 고해상도 게이밍 모니터 시장을 의미함.",https://www.businessresearchinsights.com/ko/market-reports/4k-gaming-monitors-market-100173,1043000000,False,"2022년과 비슷한 시장 규모지만, 4K 게임 모니터 시장이 2024년 10.43억 달러로 확대되면서 와이드 모니터 수요 증가 반영.",https://www.businessresearchinsights.com/ko/market-reports/4k-gaming-monitors-market-100173,1160000000,True,4K 게임 모니터 시장의 연평균 성장률 10.8%를 적용하여 2024년 시장 규모 약 11.6억 달러로 추정함.,https://www.businessresearchinsights.com/ko/market-reports/4k-gaming-monitors-market-100173
F010120,프라이버시 필름,"	야외 활동이나 역동적인 장면을 촬영하기 위해 제작된 소형 고성능 카메라로, 방수·충격 방지 기능과 광각 촬영 기능이 특징",1500000,True,"국내에서 프라이버시 필름 시장에 대한 직접적인 데이터는 부족하나, 윈도우 필름 시장 규모(2024년 약 2조 4천억 원) 및 표면 보호 필름 시장 규모를 참고하여 프라이버시 필름의 시장 점유율 및 성장률을 적용해 추정함.",https://www.fortunebusinessinsights.com/ko/window-film-market-102081,1800000,True,2022년 추정치를 기반으로 국내 윈도우 필름 시장 성장률과 프라이버시 필름 점유율 가중치를 반영해 추정함.,https://www.fortunebusinessinsights.com/ko/window-film-market-102081,2100000,True,2023년 대비 국내 시장 성장 및 기술 보급률 증가를 반영해 추정함.,https://www.fortunebusinessinsights.com/ko/window-film-market-102081,12000000,False,Mordor Intelligence 보고서에 따르면 글로벌 프라이버시 필터 시장은 2024년 1.20억 달러 규모로 평가되었음. 2022년은 이 수치를 기반으로 과거 성장률을 반영해 산출함.,https://www.mordorintelligence.kr/industry-reports/privacy-filters-market,13800000,False,Mordor Intelligence의 2024년 시장 규모와 예측 성장률 12.9%를 적용해 산출함.,https://www.mordorintelligence.kr/industry-reports/privacy-filters-market,15000000,False,2023년 대비 예상 연평균 성장률 12.9% 기반 산출함.,https://www.mordorintelligence.kr/industry-reports/privacy-filters-market
F010121,AI스피커,기존 스피커에 AI(인공지능)의 기능을 더한 스피커,,,,,,,,,,,,,)65억,False,정확한 데이터,https://www.verifiedmarketreports.com/ko/product/ai-speaker-market/,352억,False,정확한 데이터,https://www.verifiedmarketreports.com/ko/product/ai-speaker-market/,32억,False,정확한 데이터,https://www.verifiedmarketreports.com/ko/product/artificial-intelligence-ai-speakers-market-size-and-forecast/
F010201,게임기,게임을 할 수 있도록 만든 전자 기계,,,,,,,,,,,,,,,,,,,,,,,,
